{"assumptions":["common_reference"],"baseline":{"kind":"explicit","label":"generated","price":"100000"},"domain":{"lower":"60000","upper":"110000"},"exposure":{"kind":"linear","quantity":"0.25"},"legs":[{"id":"leg-0","kind":"indicator","observation_time":"2026-09-19T06:00:00Z","pays_on":{"lower":"65000","lower_inclusive":true,"upper":"65000","upper_inclusive":true},"premium":{"kind":"walked","levels":[["0.37","500"],["0.37","0"],["0.51","100"],["0.51","3000"],["0.99999","100000"]],"path":"direct_book","snapshot":"aaaaaaaaaaaaaaaaaaaaaaaaaaaaaaaaaaaaaaaaaaaaaaaaaaaaaaaaaaaaaaaa","total":"950"},"semantics":"bbbbbbbbbbbbbbbbbbbbbbbbbbbbbbbbbbbbbbbbbbbbbbbbbbbbbbbbbbbbbbbb","size":"2000"},{"id":"leg-1","kind":"indicator","observation_time":"2026-09-19T06:00:00Z","pays_on":{"upper":"75908","upper_inclusive":true},"premium":{"kind":"walked","levels":[["0.33","500"],["0.46","0"],["0.46","0"],["0.59","3000"],["0.99999","100000"]],"path":"direct_book","snapshot":"aaaaaaaaaaaaaaaaaaaaaaaaaaaaaaaaaaaaaaaaaaaaaaaaaaaaaaaaaaaaaaaa","total":"33"},"semantics":"bbbbbbbbbbbbbbbbbbbbbbbbbbbbbbbbbbbbbbbbbbbbbbbbbbbbbbbbbbbbbbbb","size":"100"},{"id":"leg-2","kind":"indicator","observation_time":"2026-09-20T06:00:00Z","pays_on":{"lower":"70000","lower_inclusive":true},"premium":{"kind":"fixed","price":"0.875"},"semantics":"bbbbbbbbbbbbbbbbbbbbbbbbbbbbbbbbbbbbbbbbbbbbbbbbbbbbbbbbbbbbbbbb","size":"924"}],"objective":[{"id":"clause_0","min_pnl":"-8000"},{"id":"clause_1","min_pnl":"-8000","on":{"lower":"65000","lower_inclusive":true,"upper":"110000","upper_inclusive":true}},{"id":"clause_2","min_pnl":"-1000","on":{"lower":"75908","lower_inclusive":true,"upper":"105000","upper_inclusive":true}}],"objective_valuation_time":"2026-09-19T06:00:00Z","other_costs":"0","reductions":[{"leg":"leg-0","reason_code":"UNREVIEWED_FAMILY","rule":"unreviewed_family","tight":false},{"leg":"leg-1","reason_code":"UNREVIEWED_FAMILY","rule":"unreviewed_family","tight":false},{"leg":"leg-2","reason_code":"LEG_WORST_CASED_HORIZON","rule":"horizon_mismatch","tight":true}],"schema_version":"1","units":{"exposure":"BTC","money":"USDC","price":"USDC per BTC","size":"contracts"}}
