{"assumptions":["common_reference"],"baseline":{"kind":"explicit","label":"generated","price":"90000"},"domain":{"lower":"60000","upper":"110000"},"exposure":{"kind":"linear","quantity":"0.1"},"legs":[{"id":"leg-0","kind":"indicator","observation_time":"2026-09-19T06:00:00Z","pays_on":{"lower":"65000","lower_inclusive":false,"upper":"110000","upper_inclusive":false},"premium":{"kind":"walked","levels":[["0.18","0"],["0.21","3000"],["0.25","100"],["0.25","500"],["0.99999","100000"]],"path":"direct_book","snapshot":"aaaaaaaaaaaaaaaaaaaaaaaaaaaaaaaaaaaaaaaaaaaaaaaaaaaaaaaaaaaaaaaa","total":"0.21"},"semantics":"bbbbbbbbbbbbbbbbbbbbbbbbbbbbbbbbbbbbbbbbbbbbbbbbbbbbbbbbbbbbbbbb","size":"1"}],"objective":[{"id":"clause_0","min_pnl":"-20000"}],"objective_valuation_time":"2026-09-19T06:00:00Z","other_costs":"0","schema_version":"1","units":{"exposure":"BTC","money":"USDC","price":"USDC per BTC","size":"contracts"}}
