{"assumptions":["common_reference"],"baseline":{"kind":"explicit","label":"generated","price":"105000"},"domain":{"lower":"60000","upper":"110000"},"exposure":{"kind":"linear","quantity":"0.25"},"legs":[{"id":"leg-0","kind":"indicator","observation_time":"2026-09-19T06:00:00Z","pays_on":{"lower":"65000","lower_inclusive":true,"upper":"90000","upper_inclusive":false},"premium":{"kind":"walked","levels":[["0.22","0"],["0.99999","100000"]],"path":"direct_book","snapshot":"aaaaaaaaaaaaaaaaaaaaaaaaaaaaaaaaaaaaaaaaaaaaaaaaaaaaaaaaaaaaaaaa","total":"0.99999"},"semantics":"bbbbbbbbbbbbbbbbbbbbbbbbbbbbbbbbbbbbbbbbbbbbbbbbbbbbbbbbbbbbbbbb","size":"1"},{"id":"leg-1","kind":"indicator","observation_time":"2026-09-19T06:00:00Z","pays_on":{"lower":"105000","lower_inclusive":false},"premium":{"kind":"walked","levels":[["0.09","0"],["0.14","100000"],["0.99999","100000"]],"path":"direct_book","snapshot":"aaaaaaaaaaaaaaaaaaaaaaaaaaaaaaaaaaaaaaaaaaaaaaaaaaaaaaaaaaaaaaaa","total":"0"},"semantics":"bbbbbbbbbbbbbbbbbbbbbbbbbbbbbbbbbbbbbbbbbbbbbbbbbbbbbbbbbbbbbbbb","size":"0"}],"objective":[{"id":"clause_0","min_pnl":"-2000"},{"id":"clause_1","min_pnl":"-8000"}],"objective_valuation_time":"2026-09-19T06:00:00Z","other_costs":"0","reductions":[{"leg":"leg-1","reason_code":"UNREVIEWED_FAMILY","rule":"unreviewed_family","tight":false}],"schema_version":"1","units":{"exposure":"BTC","money":"USDC","price":"USDC per BTC","size":"contracts"}}
