{"assumptions":["common_reference"],"baseline":{"kind":"explicit","label":"generated","price":"105000"},"domain":{"lower":"60000","upper":"110000"},"exposure":{"kind":"linear","quantity":"0.25"},"legs":[{"id":"leg-0","kind":"indicator","observation_time":"2026-09-19T06:00:00Z","pays_on":{"upper":"75908","upper_inclusive":true},"premium":{"kind":"walked","levels":[["0.06","100000"],["0.12","100"],["0.12","1200"],["0.21","100"],["0.99999","100000"]],"path":"direct_book","snapshot":"aaaaaaaaaaaaaaaaaaaaaaaaaaaaaaaaaaaaaaaaaaaaaaaaaaaaaaaaaaaaaaaa","total":"0"},"semantics":"bbbbbbbbbbbbbbbbbbbbbbbbbbbbbbbbbbbbbbbbbbbbbbbbbbbbbbbbbbbbbbbb","size":"0"},{"id":"leg-1","kind":"indicator","observation_time":"2026-09-19T06:00:00Z","pays_on":{"lower":"100000","lower_inclusive":true,"upper":"100000","upper_inclusive":true},"premium":{"kind":"fixed","price":"0.32"},"semantics":"bbbbbbbbbbbbbbbbbbbbbbbbbbbbbbbbbbbbbbbbbbbbbbbbbbbbbbbbbbbbbbbb","size":"0"},{"id":"leg-2","kind":"indicator","observation_time":"2026-09-19T06:00:00Z","pays_on":{"upper":"65000","upper_inclusive":true},"premium":{"kind":"walked","levels":[["0.09","0"],["0.15","0"],["0.27","100000"],["0.37","1200"],["0.99999","100000"]],"path":"direct_book","snapshot":"aaaaaaaaaaaaaaaaaaaaaaaaaaaaaaaaaaaaaaaaaaaaaaaaaaaaaaaaaaaaaaaa","total":"27"},"semantics":"bbbbbbbbbbbbbbbbbbbbbbbbbbbbbbbbbbbbbbbbbbbbbbbbbbbbbbbbbbbbbbbb","size":"100"},{"id":"leg-3","kind":"indicator","observation_time":"2026-09-19T06:00:00Z","pays_on":{"upper":"105000","upper_inclusive":true},"premium":{"kind":"fixed","price":"0.48"},"semantics":"bbbbbbbbbbbbbbbbbbbbbbbbbbbbbbbbbbbbbbbbbbbbbbbbbbbbbbbbbbbbbbbb","size":"1409"}],"objective":[{"id":"clause_0","min_pnl":"-20000"},{"id":"clause_1","min_pnl":"-500"}],"objective_valuation_time":"2026-09-19T06:00:00Z","other_costs":"25","schema_version":"1","units":{"exposure":"BTC","money":"USDC","price":"USDC per BTC","size":"contracts"}}
