{"assumptions":["common_reference"],"baseline":{"kind":"explicit","label":"generated","price":"85000"},"domain":{"lower":"60000","upper":"110000"},"exposure":{"kind":"linear","quantity":"0"},"legs":[{"id":"leg-0","kind":"indicator","observation_time":"2026-09-19T06:00:00Z","pays_on":{"lower":"75908","lower_inclusive":true},"premium":{"kind":"fixed","price":"0.625"},"semantics":"bbbbbbbbbbbbbbbbbbbbbbbbbbbbbbbbbbbbbbbbbbbbbbbbbbbbbbbbbbbbbbbb","size":"1409"}],"objective":[{"id":"clause_0","min_pnl":"-20000"}],"objective_valuation_time":"2026-09-19T06:00:00Z","other_costs":"25","reductions":[{"leg":"leg-0","reason_code":"UNREVIEWED_FAMILY","rule":"unreviewed_family","tight":false}],"schema_version":"1","units":{"exposure":"BTC","money":"USDC","price":"USDC per BTC","size":"contracts"}}
