{"assumptions":["common_reference","zero_base_fee"],"baseline":{"kind":"analysis_time","price":"77631.4","source":{"coin":"BTC","snapshot":"ed779f0670253d58214b98a18efe79bf08e65312b5364ebd9b49a5fd708ee1d1"}},"capture":{"max_skew_ms":"5000","measured_by":"research/2026-09-18/capture.py, recomputed from the retained request records","skew_ms":"-687"},"domain":{"lower":"60000","upper":"110000"},"exposure":{"kind":"linear","quantity":"0.1"},"legs":[{"id":"bucket0-yes","kind":"indicator","observation_time":"2026-09-19T06:00:00Z","pays_on":{"upper":"75908","upper_inclusive":false},"premium":{"kind":"walked","levels":[["0.17399","1200"],["0.174","1200"],["0.99999","100000"]],"path":"direct_book","snapshot":"00118f3902a1a8c491d1dd22782527524e71eea68f610918fa5495d5105b1218","total":"160.76677"},"semantics":"0f75191302086ba1cf59587956d1593a73372a729a98cd94556d56cda3a2b539","size":"924"}],"objective":[{"id":"loss_cap","min_pnl":"-1000"}],"objective_valuation_time":"2026-09-19T06:00:00Z","other_costs":"0","schema_version":"1","units":{"exposure":"BTC","money":"USDC","price":"USDC per BTC","size":"contracts"}}
