{"assumptions":["common_reference"],"baseline":{"kind":"explicit","label":"generated","price":"85000"},"domain":{"lower":"60000","upper":"110000"},"exposure":{"kind":"linear","quantity":"0"},"legs":[{"id":"leg-0","kind":"indicator","observation_time":"2026-09-19T06:00:00Z","pays_on":{"lower":"80000","lower_inclusive":true},"premium":{"kind":"fixed","price":"0.625"},"semantics":"bbbbbbbbbbbbbbbbbbbbbbbbbbbbbbbbbbbbbbbbbbbbbbbbbbbbbbbbbbbbbbbb","size":"1409"},{"id":"leg-1","kind":"indicator","observation_time":"2026-09-19T06:00:00Z","pays_on":{"lower":"85000","lower_inclusive":false},"premium":{"kind":"fixed","price":"0"},"semantics":"bbbbbbbbbbbbbbbbbbbbbbbbbbbbbbbbbbbbbbbbbbbbbbbbbbbbbbbbbbbbbbbb","size":"1"}],"objective":[{"id":"clause_0","min_pnl":"-4000"},{"id":"clause_1","min_pnl":"-20000"},{"id":"clause_2","min_pnl":"-500","on":{"lower":"80000","lower_inclusive":true,"upper":"100000","upper_inclusive":false}}],"objective_valuation_time":"2026-09-19T06:00:00Z","other_costs":"0","reductions":[{"leg":"leg-1","reason_code":"UNREVIEWED_FAMILY","rule":"unreviewed_family","tight":false}],"schema_version":"1","units":{"exposure":"BTC","money":"USDC","price":"USDC per BTC","size":"contracts"}}
