{"assumptions":["common_reference"],"baseline":{"kind":"explicit","label":"generated","price":"70000"},"domain":{"lower":"60000","upper":"110000"},"exposure":{"kind":"linear","quantity":"0.1"},"legs":[{"id":"leg-0","kind":"indicator","observation_time":"2026-09-19T06:00:00Z","pays_on":{"lower":"65000","lower_inclusive":true,"upper":"70000","upper_inclusive":false},"premium":{"kind":"fixed","price":"0.25"},"semantics":"bbbbbbbbbbbbbbbbbbbbbbbbbbbbbbbbbbbbbbbbbbbbbbbbbbbbbbbbbbbbbbbb","size":"0"},{"id":"leg-1","kind":"indicator","observation_time":"2026-09-19T06:00:00Z","pays_on":{"upper":"105000","upper_inclusive":false},"premium":{"kind":"fixed","price":"0.25"},"semantics":"bbbbbbbbbbbbbbbbbbbbbbbbbbbbbbbbbbbbbbbbbbbbbbbbbbbbbbbbbbbbbbbb","size":"0"}],"objective":[{"id":"clause_0","min_pnl":"-4000","on":{"lower":"60000","lower_inclusive":true,"upper":"105000","upper_inclusive":false}},{"id":"clause_1","min_pnl":"-2000"},{"id":"clause_2","min_pnl":"-20000"}],"objective_valuation_time":"2026-09-19T06:00:00Z","other_costs":"25","schema_version":"1","units":{"exposure":"BTC","money":"USDC","price":"USDC per BTC","size":"contracts"}}
