{"assumptions":["common_reference"],"baseline":{"kind":"explicit","label":"generated","price":"65000"},"domain":{"lower":"60000","upper":"110000"},"exposure":{"kind":"linear","quantity":"0.25"},"legs":[{"id":"leg-0","kind":"indicator","observation_time":"2026-09-20T06:00:00Z","pays_on":{"lower":"110000","lower_inclusive":false},"premium":{"kind":"walked","levels":[["0.11","1200"],["0.99999","100000"]],"path":"direct_book","snapshot":"aaaaaaaaaaaaaaaaaaaaaaaaaaaaaaaaaaaaaaaaaaaaaaaaaaaaaaaaaaaaaaaa","total":"11"},"semantics":"bbbbbbbbbbbbbbbbbbbbbbbbbbbbbbbbbbbbbbbbbbbbbbbbbbbbbbbbbbbbbbbb","size":"100"}],"objective":[{"id":"clause_0","min_pnl":"-1000"},{"id":"clause_1","min_pnl":"-8000","on":{"lower":"77457","lower_inclusive":true,"upper":"85000","upper_inclusive":false}}],"objective_valuation_time":"2026-09-19T06:00:00Z","other_costs":"0","reductions":[{"leg":"leg-0","reason_code":"LEG_WORST_CASED_HORIZON","rule":"horizon_mismatch","tight":true}],"schema_version":"1","units":{"exposure":"BTC","money":"USDC","price":"USDC per BTC","size":"contracts"}}
