{"assumptions":["common_reference"],"baseline":{"kind":"explicit","label":"generated","price":"80000"},"domain":{"lower":"60000","upper":"110000"},"exposure":{"kind":"linear","quantity":"0.1"},"legs":[{"id":"leg-0","kind":"indicator","observation_time":"2026-09-19T06:00:00Z","pays_on":{"lower":"70000","lower_inclusive":false,"upper":"77457","upper_inclusive":true},"premium":{"kind":"fixed","price":"0.125"},"semantics":"bbbbbbbbbbbbbbbbbbbbbbbbbbbbbbbbbbbbbbbbbbbbbbbbbbbbbbbbbbbbbbbb","size":"1409"},{"id":"leg-1","kind":"indicator","observation_time":"2026-09-19T06:00:00Z","pays_on":{"lower":"77457","lower_inclusive":true,"upper":"77457","upper_inclusive":true},"premium":{"kind":"fixed","price":"0.96"},"semantics":"bbbbbbbbbbbbbbbbbbbbbbbbbbbbbbbbbbbbbbbbbbbbbbbbbbbbbbbbbbbbbbbb","size":"1409"}],"objective":[{"id":"clause_0","min_pnl":"-8000","on":{"lower":"70000","lower_inclusive":true,"upper":"75908","upper_inclusive":true}},{"id":"clause_1","min_pnl":"-500"},{"id":"clause_2","min_pnl":"-8000","on":{"lower":"65000","lower_inclusive":true,"upper":"80000","upper_inclusive":false}}],"objective_valuation_time":"2026-09-19T06:00:00Z","other_costs":"25","schema_version":"1","units":{"exposure":"BTC","money":"USDC","price":"USDC per BTC","size":"contracts"}}
