{"assumptions":["common_reference"],"baseline":{"kind":"explicit","label":"generated","price":"105000"},"domain":{"lower":"60000","upper":"110000"},"exposure":{"kind":"linear","quantity":"1"},"legs":[{"id":"leg-0","kind":"indicator","observation_time":"2026-09-19T06:00:00Z","pays_on":{"upper":"90000","upper_inclusive":false},"premium":{"kind":"fixed","price":"1"},"semantics":"bbbbbbbbbbbbbbbbbbbbbbbbbbbbbbbbbbbbbbbbbbbbbbbbbbbbbbbbbbbbbbbb","size":"2000"},{"id":"leg-1","kind":"indicator","observation_time":"2026-09-20T06:00:00Z","pays_on":{"upper":"105000","upper_inclusive":false},"premium":{"kind":"walked","levels":[["0.24","500"],["0.24","100"],["0.99999","100000"]],"path":"direct_book","snapshot":"aaaaaaaaaaaaaaaaaaaaaaaaaaaaaaaaaaaaaaaaaaaaaaaaaaaaaaaaaaaaaaaa","total":"952.99191"},"semantics":"bbbbbbbbbbbbbbbbbbbbbbbbbbbbbbbbbbbbbbbbbbbbbbbbbbbbbbbbbbbbbbbb","size":"1409"},{"id":"leg-2","kind":"indicator","observation_time":"2026-09-20T06:00:00Z","pays_on":{"upper":"110000","upper_inclusive":true},"premium":{"kind":"walked","levels":[["0.11","3000"],["0.2","100"],["0.35","100"],["0.99999","100000"]],"path":"direct_book","snapshot":"aaaaaaaaaaaaaaaaaaaaaaaaaaaaaaaaaaaaaaaaaaaaaaaaaaaaaaaaaaaaaaaa","total":"11"},"semantics":"bbbbbbbbbbbbbbbbbbbbbbbbbbbbbbbbbbbbbbbbbbbbbbbbbbbbbbbbbbbbbbbb","size":"100"},{"id":"leg-3","kind":"indicator","observation_time":"2026-09-20T06:00:00Z","pays_on":{"upper":"70000","upper_inclusive":false},"premium":{"kind":"fixed","price":"1"},"semantics":"bbbbbbbbbbbbbbbbbbbbbbbbbbbbbbbbbbbbbbbbbbbbbbbbbbbbbbbbbbbbbbbb","size":"1"}],"objective":[{"id":"clause_0","min_pnl":"-20000"},{"id":"clause_1","min_pnl":"-4000"}],"objective_valuation_time":"2026-09-19T06:00:00Z","other_costs":"0","reductions":[{"leg":"leg-1","reason_code":"LEG_WORST_CASED_HORIZON","rule":"horizon_mismatch","tight":true},{"leg":"leg-2","reason_code":"LEG_WORST_CASED_HORIZON","rule":"horizon_mismatch","tight":true},{"leg":"leg-3","reason_code":"LEG_WORST_CASED_HORIZON","rule":"horizon_mismatch","tight":true}],"schema_version":"1","units":{"exposure":"BTC","money":"USDC","price":"USDC per BTC","size":"contracts"}}
