{"assumptions":["common_reference"],"baseline":{"kind":"explicit","label":"generated","price":"77457"},"domain":{"lower":"60000","upper":"110000"},"exposure":{"kind":"linear","quantity":"0"},"legs":[{"id":"leg-0","kind":"indicator","observation_time":"2026-09-19T06:00:00Z","pays_on":{"upper":"70000","upper_inclusive":false},"premium":{"kind":"fixed","price":"0.88"},"semantics":"bbbbbbbbbbbbbbbbbbbbbbbbbbbbbbbbbbbbbbbbbbbbbbbbbbbbbbbbbbbbbbbb","size":"924"},{"id":"leg-1","kind":"indicator","observation_time":"2026-09-19T06:00:00Z","pays_on":{"lower":"80000","lower_inclusive":false,"upper":"90000","upper_inclusive":true},"premium":{"kind":"fixed","price":"0.11"},"semantics":"bbbbbbbbbbbbbbbbbbbbbbbbbbbbbbbbbbbbbbbbbbbbbbbbbbbbbbbbbbbbbbbb","size":"0"}],"objective":[{"id":"clause_0","min_pnl":"-8000"},{"id":"clause_1","min_pnl":"-20000","on":{"lower":"60000","lower_inclusive":true,"upper":"90000","upper_inclusive":true}}],"objective_valuation_time":"2026-09-19T06:00:00Z","other_costs":"5","reductions":[{"leg":"leg-0","reason_code":"UNREVIEWED_FAMILY","rule":"unreviewed_family","tight":false},{"leg":"leg-1","reason_code":"UNREVIEWED_FAMILY","rule":"unreviewed_family","tight":false}],"schema_version":"1","units":{"exposure":"BTC","money":"USDC","price":"USDC per BTC","size":"contracts"}}
