{"assumptions":["common_reference"],"baseline":{"kind":"explicit","label":"generated","price":"70000"},"domain":{"lower":"60000","upper":"110000"},"exposure":{"kind":"linear","quantity":"1"},"legs":[{"id":"leg-0","kind":"indicator","observation_time":"2026-09-20T06:00:00Z","pays_on":{"lower":"85000","lower_inclusive":true,"upper":"100000","upper_inclusive":false},"premium":{"kind":"walked","levels":[["0.43","500"],["0.61","100"],["0.71","3000"],["0.82","3000"],["0.99999","100000"]],"path":"direct_book","snapshot":"aaaaaaaaaaaaaaaaaaaaaaaaaaaaaaaaaaaaaaaaaaaaaaaaaaaaaaaaaaaaaaaa","total":"0"},"semantics":"bbbbbbbbbbbbbbbbbbbbbbbbbbbbbbbbbbbbbbbbbbbbbbbbbbbbbbbbbbbbbbbb","size":"0"},{"id":"leg-1","kind":"indicator","observation_time":"2026-09-19T06:00:00Z","pays_on":{"lower":"77457","lower_inclusive":false},"premium":{"kind":"walked","levels":[["0.5","100"],["0.99999","100000"]],"path":"direct_book","snapshot":"aaaaaaaaaaaaaaaaaaaaaaaaaaaaaaaaaaaaaaaaaaaaaaaaaaaaaaaaaaaaaaaa","total":"0"},"semantics":"bbbbbbbbbbbbbbbbbbbbbbbbbbbbbbbbbbbbbbbbbbbbbbbbbbbbbbbbbbbbbbbb","size":"0"},{"id":"leg-2","kind":"indicator","observation_time":"2026-09-19T06:00:00Z","pays_on":{"upper":"75908","upper_inclusive":false},"premium":{"kind":"fixed","price":"0.25"},"semantics":"bbbbbbbbbbbbbbbbbbbbbbbbbbbbbbbbbbbbbbbbbbbbbbbbbbbbbbbbbbbbbbbb","size":"924"},{"id":"leg-3","kind":"indicator","observation_time":"2026-09-19T06:00:00Z","pays_on":{"lower":"105000","lower_inclusive":true},"premium":{"kind":"walked","levels":[["0.1","3000"],["0.12","500"],["0.3","1200"],["0.46","100"],["0.99999","100000"]],"path":"direct_book","snapshot":"aaaaaaaaaaaaaaaaaaaaaaaaaaaaaaaaaaaaaaaaaaaaaaaaaaaaaaaaaaaaaaaa","total":"200"},"semantics":"bbbbbbbbbbbbbbbbbbbbbbbbbbbbbbbbbbbbbbbbbbbbbbbbbbbbbbbbbbbbbbbb","size":"2000"}],"objective":[{"id":"clause_0","min_pnl":"-2000","on":{"lower":"65000","lower_inclusive":true,"upper":"100000","upper_inclusive":false}},{"id":"clause_1","min_pnl":"-8000","on":{"lower":"75908","lower_inclusive":true,"upper":"85000","upper_inclusive":false}}],"objective_valuation_time":"2026-09-19T06:00:00Z","other_costs":"25","reductions":[{"leg":"leg-0","reason_code":"LEG_WORST_CASED_HORIZON","rule":"horizon_mismatch","tight":true},{"leg":"leg-2","reason_code":"UNREVIEWED_FAMILY","rule":"unreviewed_family","tight":false},{"leg":"leg-3","reason_code":"UNREVIEWED_FAMILY","rule":"unreviewed_family","tight":false}],"schema_version":"1","units":{"exposure":"BTC","money":"USDC","price":"USDC per BTC","size":"contracts"}}
