{"assumptions":["common_reference"],"baseline":{"kind":"explicit","label":"generated","price":"75908"},"domain":{"lower":"60000","upper":"110000"},"exposure":{"kind":"linear","quantity":"0.25"},"legs":[{"id":"leg-0","kind":"indicator","observation_time":"2026-09-19T06:00:00Z","pays_on":{"lower":"75908","lower_inclusive":false,"upper":"105000","upper_inclusive":false},"premium":{"kind":"fixed","price":"0.75"},"semantics":"bbbbbbbbbbbbbbbbbbbbbbbbbbbbbbbbbbbbbbbbbbbbbbbbbbbbbbbbbbbbbbbb","size":"0"},{"id":"leg-1","kind":"indicator","observation_time":"2026-09-20T06:00:00Z","pays_on":{"lower":"70000","lower_inclusive":false,"upper":"100000","upper_inclusive":false},"premium":{"kind":"fixed","price":"0.89"},"semantics":"bbbbbbbbbbbbbbbbbbbbbbbbbbbbbbbbbbbbbbbbbbbbbbbbbbbbbbbbbbbbbbbb","size":"0"},{"id":"leg-2","kind":"indicator","observation_time":"2026-09-19T06:00:00Z","pays_on":{"lower":"90000","lower_inclusive":false},"premium":{"kind":"fixed","price":"0.875"},"semantics":"bbbbbbbbbbbbbbbbbbbbbbbbbbbbbbbbbbbbbbbbbbbbbbbbbbbbbbbbbbbbbbbb","size":"924"}],"objective":[{"id":"clause_0","min_pnl":"-1000"}],"objective_valuation_time":"2026-09-19T06:00:00Z","other_costs":"0","reductions":[{"leg":"leg-1","reason_code":"LEG_WORST_CASED_HORIZON","rule":"horizon_mismatch","tight":true}],"schema_version":"1","units":{"exposure":"BTC","money":"USDC","price":"USDC per BTC","size":"contracts"}}
